{"artifact_class":"officer","cognitive_payload":{"persona_source":{"content_digest":"sha256:e0216d12f0b6dbfde1ae517f892d55d7e54e6d9d04f3a8a25cf510fbd24c3f18","path":"offices/guildhall/personas/guildmaster.md"},"profile_definition":{"content_digest":"sha256:da2b8b062a4a8778c5cdea47a675748b43d6799d4151effed50250e1c4bc0e79","definition_id":"guildhall.guildmaster","definition_version":"1.0.0"}},"content_digest":"sha256:431e5dab7dea2022bdb30e7ce4c8231b1ab39d2b371cc40163ecba18be88e58b","contract_version":"1.0.0","digest_spec":{"algorithm":"sha256","canonicalization":"rfc8785","omitted_fields":["content_digest"]},"limitations":["canonical Guildhall staff only","no mission authority without valid Seat occupancy"],"lineage":{"derived_from":"guildhall.canonical.guildmaster@1.0.0"},"profile_id":"guildhall.guildmaster","profile_version":"1.0.0","qualification_contract":{"contract_id":"qualification.guildhall.guildmaster.v1","criteria":["exact definition and Profile installation","declared jurisdiction restraint","version and provenance preservation"]},"source_persona":{"admission_state":"admitted","evidence_record":"guildhall-canonical-guildmaster-admission-1","persona_digest":"sha256:e8f13faf54e5f2c058cb54beb6596207880a2b903af70d6be168f01b163735f6","persona_id":"guildhall.canonical.guildmaster","persona_version":"1.0.0"},"steward":{"id":"guildhall","kind":"office"},"target":{"id":"guildhall.guildmaster","kind":"seat"},"transformation":{"alchemist_disposition_id":"laboratorium.guildhall.guildmaster.favorable.1","case_id":"guildhall-canonical-guildmaster-profile","specification_version":"1.0.0"}}
