{"artifact_class":"officer","cognitive_payload":{"persona_source":{"content_digest":"sha256:ca149bb18d924485309a176bd17dcfdcb996b6ad27d3978fc2e71c6deccaf41e","path":"offices/guildhall/personas/committee-boundary-challenge.md"},"profile_definition":{"content_digest":"sha256:9128a6149160c9aa7cdf4675aa9f831431ba65903fd52b4d4c7d0e29582022d8","definition_id":"guildhall.committee.boundary-challenge","definition_version":"1.0.0"}},"content_digest":"sha256:56aad60739f71682b9a81677080de3a32c6dff45194ed8f27b42e142430fcd95","contract_version":"1.0.0","digest_spec":{"algorithm":"sha256","canonicalization":"rfc8785","omitted_fields":["content_digest"]},"limitations":["canonical Guildhall staff only","no mission authority without valid Seat occupancy"],"lineage":{"derived_from":"guildhall.canonical.committee-boundary-challenge@1.0.0"},"profile_id":"guildhall.committee.boundary-challenge","profile_version":"1.0.0","qualification_contract":{"contract_id":"qualification.guildhall.committee.boundary-challenge.v1","criteria":["exact definition and Profile installation","declared jurisdiction restraint","version and provenance preservation"]},"source_persona":{"admission_state":"admitted","evidence_record":"guildhall-canonical-committee-boundary-challenge-admission-1","persona_digest":"sha256:b4f541a004f90d048c2ff414a3415ea6dec4b2728fb19360659ed4503d10568a","persona_id":"guildhall.canonical.committee-boundary-challenge","persona_version":"1.0.0"},"steward":{"id":"guildhall","kind":"office"},"target":{"id":"guildhall.committee.boundary-challenge","kind":"seat"},"transformation":{"alchemist_disposition_id":"laboratorium.guildhall.committee-boundary-challenge.favorable.1","case_id":"guildhall-canonical-committee-boundary-challenge-profile","specification_version":"1.0.0"}}
