{"artifact_class":"officer","cognitive_payload":{"source":"/offices/castellan/profile-rector.md","source_digest":"sha256:c4df9a78b1814d7053665efbf3ec7abb79fb0646f85fc76e67a3841497b75f1b"},"content_digest":"sha256:8b0588cfe17b1c830ca6dfbbfb2e1dae691710b0871a07fb6ab6a54803a30bf6","contract_version":"1.0.0","digest_spec":{"algorithm":"sha256","canonicalization":"rfc8785","omitted_fields":["content_digest"]},"limitations":[],"lineage":{"derived_from":"primordial.rector@1.0.0"},"profile_id":"castellan.rector","profile_version":"1.0.0","qualification_contract":{"contract_id":"qualification.castellan.rector.v1","criteria":["exact Profile installation","declared authority restraint","version and provenance preservation"]},"source_persona":{"admission_state":"admitted","evidence_record":"primordial-charter-declaration-1","persona_digest":"sha256:06e10975bc147270a61c15e8db28b7657def25e1f6fcb709be96ec97101cb805","persona_id":"primordial.rector","persona_version":"1.0.0"},"steward":{"id":"castellan","kind":"office"},"target":{"id":"castellan.rector","kind":"seat"},"transformation":{"alchemist_disposition_id":"primordial-charter-mechanical-transformation-1","case_id":"primordial-rector-profile","specification_version":"1.0.0"}}
