{"artifact_class":"officer","cognitive_payload":{"persona_source":{"content_digest":"sha256:fe6face8ec79c2ecd7b18ded8b595c5cfc8e8d7263242d2f9cedbc38920bc614","path":"offices/guildhall/personas/committee-disciplinary-fit.md"},"profile_definition":{"content_digest":"sha256:ff66d245403d893f8e59724ae94768867f3a9cee759243d8f3b37f0f722a32c7","definition_id":"guildhall.committee.disciplinary-fit","definition_version":"1.0.0"}},"content_digest":"sha256:96f50f773fd0454f5b3929939caa723c4e14263d18172e14b1e4003e26b09059","contract_version":"1.0.0","digest_spec":{"algorithm":"sha256","canonicalization":"rfc8785","omitted_fields":["content_digest"]},"limitations":["canonical Guildhall staff only","no mission authority without valid Seat occupancy"],"lineage":{"derived_from":"guildhall.canonical.committee-disciplinary-fit@1.0.0"},"profile_id":"guildhall.committee.disciplinary-fit","profile_version":"1.0.0","qualification_contract":{"contract_id":"qualification.guildhall.committee.disciplinary-fit.v1","criteria":["exact definition and Profile installation","declared jurisdiction restraint","version and provenance preservation"]},"source_persona":{"admission_state":"admitted","evidence_record":"guildhall-canonical-committee-disciplinary-fit-admission-1","persona_digest":"sha256:706efbcaecba7ff3031921804739ee54780d1ac3e6cecf423c028f76db73c840","persona_id":"guildhall.canonical.committee-disciplinary-fit","persona_version":"1.0.0"},"steward":{"id":"guildhall","kind":"office"},"target":{"id":"guildhall.committee.disciplinary-fit","kind":"seat"},"transformation":{"alchemist_disposition_id":"laboratorium.guildhall.committee-disciplinary-fit.favorable.1","case_id":"guildhall-canonical-committee-disciplinary-fit-profile","specification_version":"1.0.0"}}
