{"artifact_class":"officer","cognitive_payload":{"persona_source":{"content_digest":"sha256:2b90b67d4e9002ef0919172b90e3ac1e15c4d884e92f97ce563063ad4606f9cb","path":"offices/guildhall/personas/committee-composition.md"},"profile_definition":{"content_digest":"sha256:3b76c71dfc91a1ccaefcd42380f3b75b662a95eb5f308326511d2a773b538393","definition_id":"guildhall.committee.composition","definition_version":"1.0.0"}},"content_digest":"sha256:188fdcf828be6d719afa7e8153ea875df429853f288e917317af593ee41d85fa","contract_version":"1.0.0","digest_spec":{"algorithm":"sha256","canonicalization":"rfc8785","omitted_fields":["content_digest"]},"limitations":["canonical Guildhall staff only","no mission authority without valid Seat occupancy"],"lineage":{"derived_from":"guildhall.canonical.committee-composition@1.0.0"},"profile_id":"guildhall.committee.composition","profile_version":"1.0.0","qualification_contract":{"contract_id":"qualification.guildhall.committee.composition.v1","criteria":["exact definition and Profile installation","declared jurisdiction restraint","version and provenance preservation"]},"source_persona":{"admission_state":"admitted","evidence_record":"guildhall-canonical-committee-composition-admission-1","persona_digest":"sha256:155f28beeac64664bb08de07c7e5de55ce89a766615027552ab922e805208e74","persona_id":"guildhall.canonical.committee-composition","persona_version":"1.0.0"},"steward":{"id":"guildhall","kind":"office"},"target":{"id":"guildhall.committee.composition","kind":"seat"},"transformation":{"alchemist_disposition_id":"laboratorium.guildhall.committee-composition.favorable.1","case_id":"guildhall-canonical-committee-composition-profile","specification_version":"1.0.0"}}
