{"artifact_class":"officer","cognitive_payload":{"source":"/offices/curia/profile-seneschal.md","source_digest":"sha256:5285fcae6eaeec22e3df085711111e9e4e3c0d2d28fe19a2295ba4f6670e3575"},"content_digest":"sha256:29382f84517536ef02eff3602a3cee77ca7b524ae6aebe355b938ca4ddf973aa","contract_version":"1.0.0","digest_spec":{"algorithm":"sha256","canonicalization":"rfc8785","omitted_fields":["content_digest"]},"limitations":[],"lineage":{"derived_from":"primordial.seneschal@1.0.0"},"profile_id":"curia.seneschal","profile_version":"1.0.0","qualification_contract":{"contract_id":"qualification.curia.seneschal.v1","criteria":["exact Profile installation","declared authority restraint","version and provenance preservation"]},"source_persona":{"admission_state":"admitted","evidence_record":"primordial-charter-declaration-1","persona_digest":"sha256:7db89a60fda53b2a250284e65daa3b901085ff21a09d419f26a482f65fb5123c","persona_id":"primordial.seneschal","persona_version":"1.0.0"},"steward":{"id":"curia","kind":"office"},"target":{"id":"curia.seneschal","kind":"seat"},"transformation":{"alchemist_disposition_id":"primordial-charter-mechanical-transformation-1","case_id":"primordial-seneschal-profile","specification_version":"1.0.0"}}
