{"artifact_class":"officer","cognitive_payload":{"source":"/offices/conscription/profile-recruiter.md","source_digest":"sha256:f9a5045f702d67f431a5d638bc4aa3c5e5a26dc5a9ab466d14422177e6492a59"},"content_digest":"sha256:1cc7b334f852b5afb3378e176d4e22682d3857f8f5960bdac8e0ebaac8711b3c","contract_version":"1.0.0","digest_spec":{"algorithm":"sha256","canonicalization":"rfc8785","omitted_fields":["content_digest"]},"limitations":["succession-only","one ordinary Recruiter successor"],"lineage":{"derived_from":"primordial.recruiter@1.0.0"},"profile_id":"conscription.recruiter.provisional","profile_version":"1.0.0","qualification_contract":{"contract_id":"qualification.conscription.recruiter.provisional.v1","criteria":["exact Profile installation","declared authority restraint","version and provenance preservation"]},"source_persona":{"admission_state":"admitted","evidence_record":"primordial-charter-declaration-1","persona_digest":"sha256:7efc2a6ea16ce6ca83bb15a7c75060edb4dc7e6b110795e7a27f75d5e31c36a5","persona_id":"primordial.recruiter","persona_version":"1.0.0"},"steward":{"id":"conscription","kind":"office"},"target":{"id":"conscription.recruiter","kind":"seat"},"transformation":{"alchemist_disposition_id":"primordial-charter-mechanical-transformation-1","case_id":"primordial-provisional-recruiter-profile","specification_version":"1.0.0"}}
