{"artifact_class":"officer","cognitive_payload":{"source":"/offices/curia/profile-secretary.md","source_digest":"sha256:114949b13fba28bbac8ac4ade418a9485a037da65eaf265b35f1054607978b72"},"content_digest":"sha256:80b3da619e21278f11b6926f64dec366ee937d2e5d35b5b2b3a4574ac5ac6f02","contract_version":"1.0.0","digest_spec":{"algorithm":"sha256","canonicalization":"rfc8785","omitted_fields":["content_digest"]},"limitations":["provisional-curial-assignment"],"lineage":{"derived_from":"primordial.isolde@1.0.0"},"profile_id":"curia.secretary","profile_version":"1.0.0","qualification_contract":{"contract_id":"qualification.curia.secretary.v1","criteria":["exact Profile installation","declared authority restraint","version and provenance preservation"]},"source_persona":{"admission_state":"admitted","evidence_record":"primordial-charter-declaration-1","persona_digest":"sha256:38c8707ef2f5e3a57c1946065fe49654f097fd2ccac3638b536f77a0c89d22e1","persona_id":"primordial.isolde","persona_version":"1.0.0"},"steward":{"id":"curia","kind":"office"},"target":{"id":"curia.secretary","kind":"seat"},"transformation":{"alchemist_disposition_id":"primordial-charter-mechanical-transformation-1","case_id":"primordial-secretary-profile","specification_version":"1.0.0"}}
