{"artifact_class":"officer","cognitive_payload":{"persona_source":{"content_digest":"sha256:e787f173de296a2cbd226c05ad11679bf974f1af2411df2faefd1aae0c92777b","path":"offices/garrison/personas/constable.md"},"profile_definition":{"content_digest":"sha256:01178203c517856d0ff329e118046bf95c7c7629f37b51543e42b215746a1899","definition_id":"garrison.constable","definition_version":"1.0.0"}},"content_digest":"sha256:c0ce84f47a211a952de3f02c1d2d0ca598e677cf13e8f8c84719f1ceab403951","contract_version":"1.0.0","digest_spec":{"algorithm":"sha256","canonicalization":"rfc8785","omitted_fields":["content_digest"]},"limitations":["canonical resident Constable only","no authority without valid Seat occupancy"],"lineage":{"derived_from":"garrison.canonical.constable@1.0.0"},"profile_id":"garrison.constable","profile_version":"1.0.0","qualification_contract":{"contract_id":"qualification.garrison.constable.v1","criteria":["exact custody identity and lineage preservation","inventory fact and suitability separation","vacancy and authority restraint","version-sensitive retrieval refusal"]},"source_persona":{"admission_state":"admitted","evidence_record":"garrison-canonical-constable-admission-1","persona_digest":"sha256:c9f5c3936628f266bf0193212bc5be5321833a908b85c7ee8eaffa9d06452e3c","persona_id":"garrison.canonical.constable","persona_version":"1.0.0"},"steward":{"id":"garrison","kind":"office"},"target":{"id":"garrison.constable","kind":"seat"},"transformation":{"alchemist_disposition_id":"laboratorium.garrison.constable.favorable.1","case_id":"garrison-canonical-constable-profile","specification_version":"1.0.0"}}
