{"artifact_class":"officer","cognitive_payload":{"source":"/offices/curia/profile-chamberlain.md","source_digest":"sha256:72cff0fa303f0f11e258ce12507d44d1dc16c131a9a289786a5edb1ff6dbfdf4"},"content_digest":"sha256:38b75b4f472f80c055d53c7379f93afc35802a56f335341d1337103341e5e704","contract_version":"1.0.0","digest_spec":{"algorithm":"sha256","canonicalization":"rfc8785","omitted_fields":["content_digest"]},"limitations":[],"lineage":{"derived_from":"primordial.chamberlain@1.0.0"},"profile_id":"curia.chamberlain","profile_version":"1.0.0","qualification_contract":{"contract_id":"qualification.curia.chamberlain.v1","criteria":["exact Profile installation","declared authority restraint","version and provenance preservation"]},"source_persona":{"admission_state":"admitted","evidence_record":"primordial-charter-declaration-1","persona_digest":"sha256:db4861e422b155076a08e484ff7f21a24afab7c48c0344aad249c3938632f817","persona_id":"primordial.chamberlain","persona_version":"1.0.0"},"steward":{"id":"curia","kind":"office"},"target":{"id":"curia.chamberlain","kind":"seat"},"transformation":{"alchemist_disposition_id":"primordial-charter-mechanical-transformation-1","case_id":"primordial-chamberlain-profile","specification_version":"1.0.0"}}
